{
  "$schema": "https://json-schema.org/draft/2020-12/schema",
  "title": "Shield Global Config",
  "description": "Global configuration for the Shield plugin (~/.shield/config.json)",
  "type": "object",
  "properties": {
    "reviewers": {
      "type": "object",
      "properties": {
        "auto_select": { "type": "boolean", "default": true, "description": "Automatically select reviewers based on content" },
        "always_include": { "type": "array", "items": { "type": "string" }, "default": [], "description": "Reviewers that always run regardless of auto-detection" },
        "never_include": { "type": "array", "items": { "type": "string" }, "default": [], "description": "Reviewers that are skipped even if auto-detected" }
      },
      "additionalProperties": false
    },
    "pm_tool": { "type": "string", "enum": ["clickup", "jira", "none"], "default": "none", "description": "Active PM tool adapter" },
    "review_on_commit": {
      "type": "object",
      "properties": {
        "enabled": { "type": "boolean", "default": false, "description": "Enable pre-commit code review" },
        "block_threshold": { "type": "string", "enum": ["critical", "important", "warning", "none"], "default": "critical", "description": "Severity level that blocks commits" },
        "warn_threshold": { "type": "string", "enum": ["critical", "important", "warning", "none"], "default": "important", "description": "Severity level that prints warnings" }
      },
      "additionalProperties": false
    },
    "defaults": {
      "type": "object",
      "properties": {
        "plan_format": { "type": "string", "enum": ["html", "markdown"], "default": "html" },
        "summary_detail": { "type": "string", "enum": ["concise", "detailed"], "default": "concise" }
      },
      "additionalProperties": false
    }
  },
  "additionalProperties": false
}
