{
  "reviewers": {
    "auto_select": true,
    "always_include": ["security"],
    "never_include": []
  },
  "pm_tool": "clickup",
  "review_on_commit": {
    "enabled": false,
    "block_threshold": "critical",
    "warn_threshold": "important"
  },
  "defaults": {
    "plan_format": "html",
    "summary_detail": "concise"
  }
}
